{
  "cohort": "FY2027",
  "sample": false,
  "updated": "2026-10-12",
  "source": "The 91 Green Fee projects enacted for FY2027 in Act 175 SLH 2026 (HB 1800, the supplemental budget amending Act 250 SLH 2025), as listed on the Department of Budget and Finance worksheet \"Attachment A — Green Fee Projects\" (RFP 2026-001G, August 2026): approximately $129 million across 11 departments (Office of the Governor, budget-signing release, 2026-07). Assisted extraction from the worksheet PDF; every figure and title traces to its worksheet page.",
  "fiscalPublic": true,
  "note": "Every record is an enacted appropriation — public law — and every one builds a page. Island and moku are set only where the enacted title names a place (each such reading is marked \"confirm on first report\" in geoContext); the rest are null until the program reports them. Act 96 alignment is null until the State states it. Program areas are this registry's working taxonomy, assigned from titles and corrected as programs report. Stories and outcomes stay behind the publication gate: a record publishes only with a story, at least one reported outcome, provenance, and its moku. Reports (public notices about a project) carry their source and render for every record. A human publishes, never an automated process.",
  "records": [
    {
      "id": "GF-2027-HI-001",
      "slug": "irrigation-public-safety-power-shutoff-preparedness",
      "sample": false,
      "project": "Irrigation Public Safety Power Shutoff Preparedness",
      "organization": "Agricultural Resource Management (AGR141)",
      "agency": "DOA",
      "programId": "AGR141",
      "island": null,
      "moku": null,
      "programArea": "water-systems-safety",
      "act96Alignment": null,
      "status": "planned",
      "publicationStatus": "draft",
      "award": { "fiscalYear": "FY2027", "amountUsd": 1500000, "meansOfFinancing": "Special Land and Development Fund", "nonRecurring": true, "legislativeReference": "Act 175 SLH 2026 (HB 1800), FY27 legislative adjustment to AGR141 — budget worksheet (Attachment A, RFP 2026-001G) p.1" },
      "summary": "The Legislature set aside $1,500,000 from the State's fee on visitors (the Green Fee) for FY2027 for this project, run by the Agricultural Resource Management program (AGR141) at the Department of Agriculture. One-time money from the Special Land and Development Fund. What the project does, where, and what comes of it will appear here as it is reported.",
      "location": {
        "tmk": null,
        "geoContext": "The budget line does not say where this project is. Island and moku to be reported."
      },
      "outcomes": [],
      "links": { "dashboardId": null, "storyMapId": null, "webMapId": null },
      "provenance": {
        "programRecord": "Attachment A p.1, AGR141: Agricultural Resource Management — FY27 legislative adjustment, \"Irrigation Public Safety Power Shutoff Preparedness\"",
        "authoritativeSource": "Act 250 SLH 2025 as amended by Act 175 SLH 2026 (HB 1800) — the enacted State budget; the Green Fee project worksheet published by the Department of Budget and Finance as Attachment A to RFP 2026-001G"
      }
    },
    {
      "id": "GF-2027-HI-002",
      "slug": "water-systems-safety-and-preparedness",
      "sample": false,
      "project": "Water Systems Safety and Preparedness",
      "organization": "Agricultural Resource Management (AGR141)",
      "agency": "DOA",
      "programId": "AGR141",
      "island": null,
      "moku": null,
      "programArea": "water-systems-safety",
      "act96Alignment": null,
      "status": "planned",
      "publicationStatus": "draft",
      "award": { "fiscalYear": "FY2027", "amountUsd": 1000000, "meansOfFinancing": "Special Land and Development Fund", "nonRecurring": true, "legislativeReference": "Act 175 SLH 2026 (HB 1800), FY27 legislative adjustment to AGR141 — budget worksheet (Attachment A, RFP 2026-001G) p.1" },
      "summary": "The Legislature set aside $1,000,000 from the State's fee on visitors (the Green Fee) for FY2027 for this project, run by the Agricultural Resource Management program (AGR141) at the Department of Agriculture. One-time money from the Special Land and Development Fund. What the project does, where, and what comes of it will appear here as it is reported.",
      "location": {
        "tmk": null,
        "geoContext": "The budget line does not say where this project is. Island and moku to be reported."
      },
      "outcomes": [],
      "links": { "dashboardId": null, "storyMapId": null, "webMapId": null },
      "provenance": {
        "programRecord": "Attachment A p.1, AGR141: Agricultural Resource Management — FY27 legislative adjustment, \"Water Systems Safety and Preparedness\"",
        "authoritativeSource": "Act 250 SLH 2025 as amended by Act 175 SLH 2026 (HB 1800) — the enacted State budget; the Green Fee project worksheet published by the Department of Budget and Finance as Attachment A to RFP 2026-001G"
      }
    },
    {
      "id": "GF-2027-HI-003",
      "slug": "hawaii-mesonet-system",
      "sample": false,
      "project": "Hawaiʻi Mesonet System",
      "organization": "General Administration for Agriculture (AGR192)",
      "agency": "DOA",
      "programId": "AGR192",
      "island": null,
      "moku": null,
      "programArea": "hazard-ready-communities",
      "act96Alignment": null,
      "status": "planned",
      "publicationStatus": "draft",
      "award": { "fiscalYear": "FY2027", "amountUsd": 500000, "meansOfFinancing": "Special Land and Development Fund", "nonRecurring": true, "legislativeReference": "Act 175 SLH 2026 (HB 1800), FY27 legislative adjustment to AGR192 — budget worksheet (Attachment A, RFP 2026-001G) p.1" },
      "summary": "The Legislature set aside $500,000 from the State's fee on visitors (the Green Fee) for FY2027 for this project, run by the General Administration for Agriculture program (AGR192) at the Department of Agriculture. One-time money from the Special Land and Development Fund. What the project does, where, and what comes of it will appear here as it is reported.",
      "location": {
        "tmk": null,
        "geoContext": "The budget line does not say where this project is. Island and moku to be reported."
      },
      "outcomes": [],
      "links": { "dashboardId": null, "storyMapId": null, "webMapId": null },
      "provenance": {
        "programRecord": "Attachment A p.1, AGR192: General Administration for Agriculture — FY27 legislative adjustment, \"Hawaiʻi Mesonet System\"",
        "authoritativeSource": "Act 250 SLH 2025 as amended by Act 175 SLH 2026 (HB 1800) — the enacted State budget; the Green Fee project worksheet published by the Department of Budget and Finance as Attachment A to RFP 2026-001G"
      }
    },
    {
      "id": "GF-2027-HI-004",
      "slug": "uh-biosecurity-facility",
      "sample": false,
      "project": "UH Biosecurity Facility",
      "organization": "General Administration for Agriculture (AGR192)",
      "agency": "DOA",
      "programId": "AGR192",
      "island": null,
      "moku": null,
      "programArea": "native-ecosystems-biosecurity",
      "act96Alignment": null,
      "status": "planned",
      "publicationStatus": "draft",
      "award": { "fiscalYear": "FY2027", "amountUsd": 3700000, "meansOfFinancing": "Special Land and Development Fund", "nonRecurring": true, "legislativeReference": "Act 175 SLH 2026 (HB 1800), FY27 legislative adjustment to AGR192 — budget worksheet (Attachment A, RFP 2026-001G) p.1" },
      "summary": "The Legislature set aside $3,700,000 from the State's fee on visitors (the Green Fee) for FY2027 for this project, run by the General Administration for Agriculture program (AGR192) at the Department of Agriculture. One-time money from the Special Land and Development Fund. What the project does, where, and what comes of it will appear here as it is reported.",
      "location": {
        "tmk": null,
        "geoContext": "The budget line does not say where this project is. Island and moku to be reported."
      },
      "outcomes": [],
      "links": { "dashboardId": null, "storyMapId": null, "webMapId": null },
      "provenance": {
        "programRecord": "Attachment A p.1, AGR192: General Administration for Agriculture — FY27 legislative adjustment, \"UH Biosecurity Facility\"",
        "authoritativeSource": "Act 250 SLH 2025 as amended by Act 175 SLH 2026 (HB 1800) — the enacted State budget; the Green Fee project worksheet published by the Department of Budget and Finance as Attachment A to RFP 2026-001G"
      }
    },
    {
      "id": "GF-2027-HI-005",
      "slug": "seabird-habitat-protection-through-invasive-species-control",
      "sample": false,
      "project": "Seabird Habitat Protection through Invasive Species Control",
      "organization": "General Administration for Agriculture (AGR192)",
      "agency": "DOA",
      "programId": "AGR192",
      "island": null,
      "moku": null,
      "programArea": "native-ecosystems-biosecurity",
      "act96Alignment": null,
      "status": "planned",
      "publicationStatus": "draft",
      "award": { "fiscalYear": "FY2027", "amountUsd": 226140, "meansOfFinancing": "Special Land and Development Fund", "nonRecurring": true, "legislativeReference": "Act 175 SLH 2026 (HB 1800), FY27 legislative adjustment to AGR192 — budget worksheet (Attachment A, RFP 2026-001G) p.2" },
      "summary": "The Legislature set aside $226,140 from the State's fee on visitors (the Green Fee) for FY2027 for this project, run by the General Administration for Agriculture program (AGR192) at the Department of Agriculture. One-time money from the Special Land and Development Fund. What the project does, where, and what comes of it will appear here as it is reported.",
      "location": {
        "tmk": null,
        "geoContext": "The budget line does not say where this project is. Island and moku to be reported."
      },
      "outcomes": [],